{
  "operator_id": "beeline_uz",
  "version": 2,
  "status": "active",
  "smpp_profile": {
    "max_window": 50,
    "tps_limit": 500,
    "bind_count": 4,
    "reconnect_policy": { "initial_backoff_ms": 500, "max_backoff_ms": 30000, "multiplier": 2.0 },
    "enquire_link_interval_sec": 30,
    "dlr_supported": true,
    "dlr_reliable": true,
    "query_sm_enabled": true,
    "query_sm_separate_bind": true,
    "query_sm_rate_limit": 20
  },
  "http_profile": {
    "endpoint_url": "https://api.beeline.uz/sms/v1/send",
    "tps_limit": 200,
    "webhook_auth": { "type": "HMAC_SIGNATURE", "credential_ref": "vault://operators/beeline_uz/webhook_hmac" },
    "retry_policy": { "max_attempts": 3, "backoff_ms": 1000 },
    "reconnect_policy": { "initial_backoff_ms": 500, "max_backoff_ms": 30000, "multiplier": 2.0 }
  }
}
